{
    "id": "d7a8e5f1-1234-5678-9abc-def012345678",
    "name": "Test App",
    "publisher": "Test Publisher",
    "version": "1.0.0.0",
    "application": "26.5.0.0",
    "platform": "26.0.0.0",
    "runtime": "14.0",
    "target": "Cloud",
    "idRanges": [
        {
            "from": 50100,
            "to": 50199
        }
    ],
    "dependencies": []
}
